{
  "subject_id": "example-001",
  "target": "presence",
  "context": "illustrative disorders-of-consciousness research profile",
  "state": "mixed_or_dissociated",
  "channels": [
    {
      "name": "behavior",
      "value": 0.0,
      "interpretable": true,
      "validation_domain": "bedside command following",
      "uncertainty": null,
      "quality_notes": "No reproducible command following in this illustrative record.",
      "negative_supports_absence": false
    },
    {
      "name": "task_eeg",
      "value": 1.0,
      "interpretable": true,
      "validation_domain": "covert command-following paradigm",
      "uncertainty": null,
      "quality_notes": "Illustrative positive task response; not real patient data.",
      "negative_supports_absence": false
    },
    {
      "name": "tms_eeg",
      "value": null,
      "interpretable": false,
      "validation_domain": "perturbational capacity",
      "uncertainty": null,
      "quality_notes": "Not acquired.",
      "negative_supports_absence": false
    }
  ],
  "assumptions": [
    "Task response is technically valid and not an artifact.",
    "The task operationalization is appropriate for covert command following."
  ],
  "allowed_claim": "Illustrative evidence pattern compatible with covert cognitive command following.",
  "forbidden_claims": [
    "Direct measurement of qualia.",
    "A universal scalar consciousness value.",
    "Clinical diagnosis from this illustrative record."
  ],
  "metadata": {
    "example_only": "true",
    "clinical_use": "prohibited"
  }
}
